"2007 11 22 - 2008 08 15","evalueringen, indberettes, evaluering, bedømmer, velundersøgt, pilotstudie, vurderingen, bedømme, udmærket, dejlig","2007, succeshistorie, 1996, 1977, 1997, 1976, 2004, 2006, 1991, 2011","screeningsalderen, age, gennemsnitsalderen, gennemsnitsalder, aged, aldersgrænsen, aldersgrænse, old, antage, amerikanere","kræftsagen, halskræfttilfælde, brystkræftsagen, kræftplanen, kræftforskningen, livmoderhalskræftvaccinen, hovedhalskræft, kræftforskning, kræfthandlingsplan, kræftplan","gardasil, gardasils, gardasil9, panodil, gradvis, udadtil, gurdon, hertil, generel, gladsaxe","hpvvaccineret, hpv, hpvtyper, hpvvirus, hpvvaccine, papillovirus, vaccine3, hpvvaccinen, hpv16, hpvvaccination","kræftvaccinen, kræftvaccinationer, kræftvacciner, kræftvaccine, kræftvaccination, børnevaccinationsprogrammerne, kjær, kræftvirussen, vaccinationsgrad, børnevaccinationsprogrammer","livmoderhalsen, livmoderhals, livmoderhalsens, livmoderhalskraft, livmoderhalskræfter, livmoder, livmoderhalskræftsenere, livsmoderhalskræft, livmoderen, livmoderhalskræften","screeningsalderen, diagnosetidspunktet, drengene, sønnerne, undersøgelsesperioden, drengebørn, børnelæger, tidsfrister, drengenes, aldersgrupperne","livmoderhalskræftkoster, finanslovsforslaget, finanslovsforhandlingerne, finanslovsudspillet, udgifter, udgifterne, finansministeriet, finansminister, omkostning, finansiering","patientstøtte, sundhedsministeriet, patientsikkerhed, sundhedsministeren, sundhedsminister, patientsikkerheden, sundhedsstyrelsen, ventelisterne, sundhedsdatastyrelsen, sygehusvæsenet","livmoderhalskræftkoster, hpvtest, villemoes, hpv18, hpv30, vævsprøver, vulvacancer, vævsprøve, hpvtyper, viborg","kræftvaccinen, kræftvaccine, kræftvacciner, kræftvaccination, kræftvaccinationer, kræftknuder, kræftforskere, kræftforsker, kræftcelle, kræftcellerne","kønsvorter, kønsvorterne, kønsvorte, træthedsyndrom, vortevirus, rothman, træthedssyndromet, træthed, værten, emne","klarhed, kønssygdom, rigtig, kønssygdommen, kønssygdommene, kønssygdomme, kram, sexolog, kristian, gynækolog","vaccinenhpv, hpvinfektion, hpvvaccinerede, hpvvacciner, vaccinehpv, hpvvaccinationen, virushpv, virusser, virussens, hpvvaccinen","kønsvorter, kønsvorter2, miskredit, kønsvorte, kønsvorterne, modstridende, omstridte, hudvorter, forvirring, miskreditere","østdanmark, pigernesresultatet, kønsvorter, kønsvorterne, grønland, færøerne, kønsvorte, københavnerne, københavnsområdet, københavnere","kønsvorter, kønsvorterne, kønsvorte, kønsvorter2, vorter, værter, behandlingsresultater, hudvorter, vorterne, puberteten","hpvdebattendebatten, forskningschef, højteknologifonden, kommunikationsrådgiver, finansdirektør, forebyggelseschef, centerdirektør, danish, projektchef, informationsmødet"
"2008 08 15 - 2009 05 08","evalueringen, evaluation, evaluering, pigebørn, udbydes, komiteen, lægemiddelovervågning, vurderingen, børneafdelingen, udstedte","nobelpris, nobelprisen, forskningsresultat, forskningsresultater, 1974, 1998, 2004, forskningsprojekter, 1977, 1978","screeningsalderen, years, gennemsnitsalderen, resulterer, age, italien, resultere, gennemsnitsalder, liter, årsalderen","cancerimmunterapier, livmoderhalskræftvaccinen, kræftvaccinationer, hovedhalskræft, kræftvaccination, kræftvaccine, kræftforskningen, kræftvacciner, livsmoderhalskræft, livmoderhalskræften","forskerne, replikerende, revolutionerede, myterne, talentfulde, udbredte, personerne, ungdommen, inkarnerede, universiteterne","hpv, hpvvirus, hpvvaccineret, hpv16, hpvvaccination, papillomvirus, hpvvaccine, hpvvaccinationen, hpvtyper, højrisikotyper","kræftvaccinen, børnevacciner, børnevaccinationsprogrammerne, børnevaccine, kræftvacciner, børnevaccinationsprogrammer, børnevaccina, kræftvaccine, vaccinebivirkninger, børnevaccinationsprogrammet","livmoderhalsen, livmoderhalsens, livmoderhals, livmoder, livmoderen, livmoderhalskraft, livmorhalsen, livmoderhalskræftog, livmoderhalskræfter, livmoderhalskræftpatienter","cost, paywall, livmoderhalskræftkoster, omkostninger, kosten, omkostning, udgifter, tobakspriser, milliarder, medicinpriser","livmoderhalskræftkoster, finanslovsforslaget, cost, engangsbeløb, finanslovsudspillet, finanslovsforhandlingerne, omkostning, budget, kosten, millionstøtte","mænds, mænd, moden, crüger, grad, kræftforebyggelse, chancer, men, bud, cunnilingus","papillomer, kirtler, underlivskræft, kjærsgaard, klitoris, hpvtest, hpv30, teenagepiger, hpv18, penishovedet","kræftvaccinen, kræftforsker, kræftforskere, kræftforskningen, kræftvaccine, kræftforskning, kræftvacciner, kræftforskeres, kræftvaccination, vaccinationsforskningen","pigernesresultatet, 1982, 1972, resulterede, succeshistorie, årevis, resultat, 740, 2012, 2022","speciallæger, læge, kigge, kønssygdom, speciallæge, misbrug, lægesønner, ligefrem, sygdomshistorie, sygedage","hpvvaccinerede, papillovirus, papillomvirus, virale, hpvinfektion, hpvvaccine, hpvvaccinationen, hpvvaccinen, virushpv, hpvvirus","1995, 1996, screeningsalderen, aldersgrænsen, 1926, 1975, 1976, 1993, fødselsårgang, 1991","danmarksmester, københavnerne, københavnere, pigernesresultatet, førstepladsen, førsteplads, midtjylland, midtjyllands, danskere, odenseaner","hundredvis, albertslund, astrid, lif, hundredevis, trist, hæstorp, 24syv, alberslund, freil","børneeksem, eksem, leukæmi, migræne, bivirkningsramt, smertesymptomer, bivirkningsramte, bivirkning, celleforandringer, lymfødem"
"2009 05 08 - 2010 01 29","komiteen, utilfreds, utilfredse, omkostningseffektiv, ligebehandlingsnævnet, utilfredshed, utilfredsstillende, pilotprojekt, vurderingen, banebrydende","bekymret, betænkeligheder, bekymrende, kræftsyg, usikkerhed, bekymringen, rådgive, kræftens, bekymrede, trættende","age, gennemsnitsalderen, aged, gennemsnitsalder, old, years, american, screeningsalderen, årsalderen, aldersgrænsen","ubeskyttet, kondomer, kondomet, kondom, kønsvorter, sexsygdomme, sexpartnere, gonorré, kønsvorterne, snøre","gardasil, gardasils, gardasil9, gradvis, panodil, cervarix, gradvist, varsler, greider, forestil","forfattere, skuespillere, forfatterne, insisterede, diætist, ældreminister, frisører, underholdning, skuespiller, lykkeligste","vaccinebivirkninger, kræftvirussen, kræftvaccinen, vås, evigt, vortevirus, vorte, eva, vort, evig","livmoderhalsen, livmoderhals, livmoderhalsens, livmoderhalskraft, livmoder, livmoderen, livmorhalsen, livsmoderhalskræft, livmoderhalskræftog, livmoderhalskræftsundhed","screeningsalderen, børneagentur, børnelæger, aldersgrupper, børnelæge, aldersgrupperne, børnelægen, drengebørn, aldersgruppe, årsalderen","livmoderhalskræftkoster, finanslovsforslaget, finanslovsforhandlingerne, cost, bekostning, omkostninger, omkostning, udgifter, medicinpriser, engangsbeløb","kræftforebyggelse, bebuder, gentager, kræftforebyggende, screeningsalderen, cunnilingus, mandler, grand, levealder, forudsiger","livmoderhalskræftkoster, underlivskræft, kapitalforhøjelse, kapitalforhøjelsen, penishovedet, hpv16, hpvtyper, livmoderhalskræfthvert, kræftknuder, bugspytkirtelkræft","69, fagperson, 35, solely, højindkomstlande, habilitet, 65, 16, 26, 19","rothman, fællesbetegnelsen, embedsmand, kromosomernes, uvidenhed, mændene, comprehensive, fællesbetegnelse, modargument, men","gynækologer, ligefrem, fejle, ligeglad, gynækolog, afdelingslæge, læges, speciallæge, gynækologiske, gynækologen","kræftdødsfald, kræftplan, kræftplanen, kræfthandlingsplan, kræfttilfældene, kræfttilfælde, kræftbehandling, cancerregisteret, kræftproblemerne, kræftbehandlingen","aldersgrænsen, aldersgrænse, 1995, screeningsalderen, vaccinationstidspunktet, 1996, 1975, 1926, pensionsalderen, free","østdanmark, mandlerne, danmarksmester, madsen, midtjylland, vaccinationsdeltagelsen, vaccinationsdeltagelse, midtjyllands, landsformand, regionerne","hundredevis, hundredvis, folkeblad, haderslev, herlev, josefsen, opgav, nordcan, 100065, 24syv","informationskampagne, forebyggelseschef, nyhedsbureauet, sundhedssektoren, hovedbestyrelsen, fagligheden, vaccinationsprogrammerne, pseudovidenskab, oplysningskampagner, sundhedsdatastyrelsen"
"2010 01 29 - 2010 10 22","apotekerforening, lægemiddelmyndighed, ligeglad, lægemiddelmyndigheder, evalueringen, vurderingen, lokalafdeling, ligebehandlingsnævnet, lokalforening, komiteen","utilsigtet, usikkerhed, bekymret, undgår, undgås, uansvarligt, forsigtig, nægte, skuffet, forsigtigt","informationskampagne, informationsmøde, informationsmødet, kampagne, lokalforening, oplysningskampagne, konference, lokalforeningen, indsamlingsshow, kampagnen","kondomer, kondomet, kondom, kønsvorter, seksualvaner, ubeskyttet, kønsvorterne, sexsygdomme, sexpartnere, seksualpartnere","ungdommen, forskergruppe, opgaven, forskergrupper, ressourcerne, tiltagende, tidskrævende, ugerne, pillerne, håbe","drengene, lykkeligste, skuespillere, danmarksmester, diætist, journalisterne, frisører, forfattere, butikkerne, ældreminister","screeningsafdeling, screeningsundersøgelse, screeningsundersøgelser, screeningstest, screeningsmetode, livmoderhalskræftscreening, screening, screenings, screeningsmetoder, mammografiscreening","livmoderhals, livmoderhalsen, livmoderhalsens, sikkerhedsprofil, tidshorisonten, livmorhalsen, livmoderhalskræftog, igum, livstidsrisikoen, livmoder","cost, kosten, omkostning, livmoderhalskræftkoster, omkostninger, population, kostede, udgiften, hylden, værdien","livmoderhalskræftkoster, finanslovsforhandlingerne, medicinpriser, milliardaftale, cost, finanslovsforslaget, omkostning, budget, omkostninger, bekostning","kræftforebyggelse, gengæld, kræftforebyggende, fornuftsargumenter, attraktivt, kyndigt, rådgive, tyndt, oprindeligt, gavnlig","livmoderhalskræftkoster, underlivskræft, livmoderhalskræftpatienter, livmoderhalskraeft, livmoderhalskræfthvert, papillomer, livmoderhalskræfttilfældene, kælderlejligheder, livmoderhalskræft, livmoderhalskræfttilfælde","screeningsalderen, medieomtale, pensionsalderen, informationsmateriale, nedsatte, incitamentsaflønning, mindreårige, fagpersoner, fåtal, informationsmaterialet","pigernesresultatet, vaccinationsprocenten, vaccinationsprocent, deltagerprocenten, vaccinationsraten, toplinjeresultater, procent, indbyggere, succeshistorie, resulterede","ledes, ledet, søsat, ydet, yde, søs, syge, hedegaard, kedelig, sygehistorie","kræfthandlingsplan, kræftplanen, kræftplan, kræftdødsfald, kræftproblemerne, cancerregistret, cancerregisteret, kraftnedsættelse, kræftbehandling, kræftbehandlingen","1975, 1995, aldersgrænsen, 1926, 2005, aldersgrænse, 2025, fødselsårgang, 1996, 365","østdanmark, vaccinationsdeltagelsen, vaccinationstallene, vaccinationsprocenten, vaccinationstilslutningen, vaccinationsraten, danmarksmester, vaccinationsdeltagelse, vaccinationsprocent, vaccinetilslutningen","hundredvis, hundredevis, bliv, herlev, 24syv, enkeltvis, fremvise, slippe, ingerslev, haderslev","smertesymptomer, muskelsmerter, migræne, betina, bivirkningsramt, brystsmerter, mavesår, betændt, langtidsvirkningerne, følgevirkninger"
"2010 10 22 - 2011 07 15","mundkræft, mundsvælgkræft, mundsvælgskræft, mundhulekræft, halskræft, hovedhalskræft, halskræfthos, kræftvirus, halscancer, kræftvirussen","usikkerhed, kræftvaccination, undgår, kræftsyg, utrygge, bekymrende, skræmme, kræftvaccinationer, nægter, kræftrisiko","age, screeningsalderen, aged, gennemsnitsalderen, years, gennemsnitsalder, årsalderen, old, dollars, dollar","hovedhalskræft, kræftforskningen, kræftforskning, oncology, kræftsagen, halskræfttilfælde, halskræft, kræftforskere, børnekræft, kræftvaccinationer","haften, forskningsarbejde, myten, fyldes, holten, fyldte, hypotese, opgaven, ungdommen, hypotesen","hpv, hpv16, vaccine3, hpvvirus, hpvvaccination, papillovirus, hpvvaccine, hpv30, papillomvirus, hpvvaccineret","vaccinebivirkninger, kræftvaccinen, kræftvaccine, kræftvacciner, vacca, kræftvaccination, kræftvaccinationer, vaccina, vaccinedækning, indsprøjtningerne","drengene, drengebørn, drengen, drengenes, drenges, drenge, mændene, dreng, paywall, men","cost, kosten, omkostninger, omkostning, udgiften, bekostning, livmoderhalskræftkoster, omkostningerne, udgifter, medicinpriser","livmoderhalskræftkoster, finanslovsforslaget, finanslovsforhandlingerne, finanslovsudspillet, cost, omkostninger, budget, omkostning, bekostning, finansminister","grad, kræftforebyggelse, odds, kræftforebyggende, andel, gengæld, deltagerprocenten, dækningsgrad, respekten, rådgive","livmoderhalskræftkoster, hpvtest, underlivskræft, penishovedet, vulvacancer, hpv30, livmoderhalskraeft, annemette, analkræft, peniskræft","kræftforsker, kræftvaccinen, kræftforskere, kræftvaccine, kræftvacciner, kræftforskningen, kræftvirus, kræftforskeres, kræftforskning, kræftvirussen","rothman, jamen, userneeds, eukaryote, embedsmand, kan, træthedsyndrom, myelomatose, mens, mand","kønssygdom, kønssygdomme, kønssygdommene, sundhedsproblemer, kønssygdommen, helbredsproblemer, kønsdele, kønsorganer, kønsorganerne, gynækologer","kræftplanen, kræftplan, kræfthandlingsplan, kræftdødsfald, kræftproblemerne, kræftbehandling, cancerregisteret, kræftrisiko, kræftrisikoen, kræftbehandlingen","anslår, drøftet, konkludere, konkluderet, undervurderer, diskuteret, tværtimod, omvendt, versus, tvivlsomt","østdanmark, københavnerne, københavnere, vaccinationsdeltagelsen, vestjylland, danmarksmester, vaccinationsdeltagelse, mandlerne, danskere, denmark","herlev, haderslev, 24syv, hundredevis, hundredvis, pris, hbv, frihed, ingerslev, livs","hpvdebattendebatten, sundhedsdebatten, informationskampagne, centerdirektør, sundhedspolitikere, forebyggelseschef, højteknologifonden, sundhedskampagner, forskningschef, pseudovidenskab"
"2011 07 15 - 2012 04 06","mundkræft, mundsvælgkræft, mundsvælgskræft, hovedhalskræft, mundhulekræft, halskræft, halskræfthos, kræftvirus, kræftvirussen, halskræfttilfælde","forskningsresultat, nobelpris, 1902, 1982, forskningsresultater, 1983, 2000, 1930, results, 1955","gennemsnitsalderen, screeningsalderen, gennemsnitsalder, age, årsalderen, livstidsrisikoen, old, years, aged, unormalt","fodvorter, kondomer, kønsvorter, seksualpartnere, kondomet, sexpartnere, kondom, smittespredningen, kønsvorterne, seksualvaner","gardasil, gardasils, gardasil9, gradvis, cervarix, gradvist, panodil, hertil, greider, dertil","vaccine3, hpvvaccineret, hpv16, papillomvirus, højrisikotyper, vaccine2, papillovirus, hpvtyper, hpvvirus, hpvvaccination","truffet, evigt, verdenshistorien, vaccinebivirkninger, kræftvaccinen, udfaldet, udfald, dødsfaldene, kræftdødsfald, dødsfald","livmoderhals, livmoderhalsen, livmoder, livmoderhalsens, livmoderhalskraft, livsmoderhalskræft, livmorhalsen, livmoderen, livmoderhalskræfter, livmorhalskræft","screeningsalderen, drengebørn, tidsplan, drengene, ældreminister, sundhedsminister, børneagentur, sundhedsudvalg, sundhedsminsiter, aldersgrænsen","finanslovsforslaget, finanslovsforhandlingerne, finanslovsudspillet, livmoderhalskræftkoster, budget, finansminister, finansloven, omkostninger, engangsbeløb, finansministeriet","grad, dækningsgrad, andel, dækningsgraden, kræftforebyggelse, procentdel, grade, gavnligt, prævention, prevention","livmoderhalskræftkoster, underlivskræft, hpvtest, penishovedet, underlivsundersøgelse, livmoderkræfttilfælde, papiloma, livmoderhalskræfthvert, analkræft, livmoderhalskraeft","risikoprofil, fagperson, 19, incitamentsaflønning, handicap, habilitet, risikoprofilen, responsible, pensionsalderen, solely","rothman, tværfaglige, kønsvorterne, tværfagligt, kønsvorter, vandet, vanvittige, virussens, kønsvorte, vås","kønssygdom, kønssygdomme, kønssygdommene, kønssygdommen, læger, køns, kønsorganerne, gynækologer, læges, kønsdele","kræftdødsfald, kræfthandlingsplan, kræftplanen, kræftplan, kræftbehandling, cancerregisteret, cancerregistret, kræftbehandlingen, kræftramte, kræftbehandlinger","aldersgrænsen, aldersgrænse, 1926, 1996, free, 26, fødselsårgang, gratis, 1955, 25","vaccinationsdeltagelsen, vaccinationsdeltagelse, danmarksmester, københavnerne, vestjylland, ishøj, midtjyllands, vaccinationsdækningen, københavns, københavnsområdet","frihed, sygdomsfri, højrisikoland, frigivet, silkeborg, freil, releaseid, hundredevis, gratis, højst","smertesymptomer, symptom, muskelsmerter, symptomer, brystsmerter, symptomerne, sygdomssymptomer, menstruationssmerter, migræne, strubelågsbetændelse"
"2012 04 06 - 2012 12 28","omkostningseffektiv, omkostningseffektivt, evalueringen, særafdelinger, lokalafdeling, vurderingen, besparelse, tilfredsstillende, komiteen, ligebehandlingsnævnet","forskningsresultat, nobelpris, forskningsresultater, 1801, 1982, 1800, 1902, resultater, 1990, nobelprisen","informationskampagne, informationsmøde, informationsmødet, pressemøde, kampagne, pressemødet, mødet, hjemmesiden, præsentation, indsamlingen","kondomer, kønsvorter, fodvorter, kondomet, kondom, kønsvorterne, vorter, sexpartner, slutter, hudvorter","spotte, rokke, håbe, unge, bolette, ungdommen, stolte, pillerne, flokimmuniteten, tolke","skuespillere, forfattere, forfatterne, skuespiller, forfatternes, aktørerne, bjarne, skuespillerinden, journalisterne, forfatteren","kræftvaccinen, groft, kræftvaccine, vaccinebivirkninger, kræftvacciner, truffet, tv2, vacca, vaccine2, vagt","drengebørn, drengene, drengenes, drengen, drenges, mændene, drengevaccine, sønnerne, drenge, mænds","udgiften, cost, milliarder, royalties, omkostning, million, udgifter, værdien, udgifterne, udgift","livmoderhalskræftkoster, cost, finanslovsforslaget, finanslovsforhandlingerne, bekostning, kosten, finanslovsudspillet, omkostning, omkostninger, budget","kræftforebyggelse, kræftforebyggende, procents, chancer, procent, overlevelseschancer, procentdel, fornuftsgrænsen, intelligens, dækningsgrad","livmoderhalskræftkoster, underlivskræft, livmoderkræfttilfælde, krüger, peniskræft, crüger, livmoderhalskræfttilfælde, klippe, livmoderhalskræfthvert, livmoderhalskraeft","medieomtale, fagperson, teenage, screeningsalderen, eventuelle, samfundssind, interessesammenfaldet, mediedebat, risikoprofil, 17","rothman, fagperson, dupont, vagt, mens, dtu, jamen, du, mund, umage","kønssygdommene, kønssygdom, kønssygdomme, kønssygdommen, læger, kønsdele, kønsdelene, kønslæberne, lægesønner, kønslæber","kræfthandlingsplan, kræftplanen, kræftplan, kræftdødsfald, kræftproblemerne, kræftbehandling, kræfttilfældene, kræftbehandlinger, kræftbehandlingen, cancerregisteret","fødselsårgang, aldersgrænsen, vaccinationstidspunktet, tidsfrist, tidsfrister, 1995, 1997, aldersgrænse, 103, 2003","danmarksmester, denmark, danskere, danskernes, københavnerne, danske, vaccinationsdeltagelsen, københavnere, danish, østdanmark","kønsvorter, kønsvorterne, kønsvorte, kønsvorter2, vorter, kønsorganer, vorte, vort, kønsorganerne, vorterne","højteknologifonden, centerdirektør, kampagneekspert, forskningschef, pseudovidenskab, forebyggelseschef, kommunikationsrådgiver, oplysningskampagner, teknologiplatform, oplysningskampagne"
"2012 12 28 - 2013 09 20","mundsvælgkræft, mundkræft, mundsvælgskræft, mundhulekræft, halskræft, hovedhalskræft, halskræfthos, halscancer, kræftvirus, kræftvirussen","usikkerhed, bekymret, bekymringerne, bekymringen, bekymringer, bekymrende, uansvarligt, bekymrede, betænkeligheder, misforståelser","age, screeningsalderen, gennemsnitsalderen, aged, old, gennemsnitsalder, years, aldersgrænsen, american, aldersgrænse","hovedhalskræft, hjernekræft, oncology, halskræft, kræftforskningen, cancerimmunterapier, halskræfttilfælde, livsmoderhalskræft, livmoderhalskræften, mavekræft","gardasil, gardasils, gardasil9, gradvis, panodil, gradvist, gerdes, greider, gurdon, hertil","skuespillere, skuespiller, skuespillerinden, skuespilleren, lykkeligste, forfattere, underholdning, aktørerne, forfatterne, oscars","kræftvaccinen, vaccinebivirkninger, kræftvacciner, kræftvaccine, kræftvaccinationer, kræftvaccination, 1990erne, kræftdødsfald, kræftens, truffet","drengebørn, drengene, drengen, mændene, drengenes, dreng, men, drenge, regning, drenges","cost, omkostning, kosten, omkostninger, udgiften, royalties, udgifter, bekostning, omkostningerne, paywall","screeningsundersøgelser, undersøgelsen, screeningsdeltagelsen, screeningsundersøgelse, befolkningsundersøgelser, spørgeskemaundersøgelse, vaccinationsforskningen, undersøgelsens, forskergrupper, screeningsdeltagelse","dækningsgrad, kræftforebyggelse, kræftforebyggende, dækningsgraden, procentdel, respekt, grad, andel, chancer, kyndigt","vaccination, vaccinations, vaccines, influenzavaccination, vaccinationer, mæslingevaccine, mæslingevacciner, vaccine, børnevaccinationer, influenzavaccine","medieomtale, habilitet, 34, incitamentsaflønning, irrelevant, risikoprofil, 35, presseomtale, fagperson, interessesammenfaldet","rothman, myelomatose, europas, ema, embedsmand, emnet, træthedsyndrom, ugens, anus, fagperson","læge, læger, gynækologer, gynækolog, kønssygdomme, kønssygdommene, kønssygdom, sexolog, læges, speciallæger","papillovirus, papillomvirus, hpvvirus, virushpv, hpvvaccinerede, vaccinehpv, vaccinenhpv, hpvinfektion, livmoderhalsen, papillomavirus","aldersgrænsen, 1995, 1975, 1991, aldersgrænse, vaccinationstidspunktet, fødselsårgang, 1985, 1955, free","danmarksmester, østdanmark, vaccinationsdeltagelsen, vaccinationsdeltagelse, midtjyllands, midtjylland, danskernes, vaccinationsdækningen, danskere, københavnerne","kønsvorterne, kønsvorter, kønsvorte, kønsvorter2, vorter, vorte, vorterne, fodvorter, vort, reducerer","højteknologifonden, forskningschef, kampagneekspert, pseudovidenskab, forebyggelseschef, centerdirektør, kommunikationsrådgiver, informationskampagne, journalisthøjskole, offentligheden"
"2013 09 20 - 2014 06 13","mundkræft, mundsvælgkræft, mundsvælgskræft, mundhulekræft, halskræft, hovedhalskræft, halskræfthos, kræftvirus, tobakssygdom, mundsvælget","forskningsresultat, nobelpris, forskningsresultater, results, resultat, forskningsinstitutioner, 1990, nobelprisen, 1977, 1982","informationsmøde, informationsmødet, pressemøde, lokalforeningen, informationskampagne, lokalforening, pressemødet, repræsentantskabsmøde, møde, indsamlingsshow","kondomer, kønsvorter, fodvorter, kønsvorterne, kondomet, kondom, hudvorter, ubeskyttet, kønsvorter2, vorte","gardasil, gardasils, gardasil9, gradvis, panodil, gradvist, dertil, cervarix, udadtil, hertil","skuespillere, forfattere, underholdning, forfatterne, skuespiller, lykkeligste, kritikerne, journalisterne, forfatternes, lærere","screeningsmetode, screeningsmetoder, screeningsafdeling, livmoderhalskræftscreening, screeningstilbuddet, screeningsundersøgelse, screeningstest, screeningsprogram, screening, screeningsundersøgelser","livsmoderhalskræft, livmoderhalsen, livmoderhals, livmoderhalskraft, livmoderhalsens, livmoder, livmoderhalskræften, livmoderhalskræfter, livmorhalskræft, livmoderhalskræft","cost, omkostning, udgiften, royalties, omkostninger, bekostning, udgifter, kosten, omkostningerne, livmoderhalskræftkoster","undersøgelsen, forskningsundersøgelse, vaccinationsforskningen, forskergruppe, forskergrupper, forskergruppen, undersøgelsens, forskerhold, befolkningsundersøgelse, befolkningsundersøgelser","bivirkningsindberetninger, hovedpine, bivirkningskomitéen, bivirkningsramte, bivirkningskomité, smertesyndromer, bivirkningsramt, bivirkningsprofil, smertesyndromet, bivirkning","livmoderhalskræftkoster, underlivskræft, vulvacancer, livmoderhalskraeft, hpvtest, analkanalen, livmoderkræfttilfælde, cervixcancer, livmoderhalskræfthvert, herfra","risikoprofil, informationsindsats, risikoprofilen, incitamentsaflønning, screeningsalderen, informationsindsatsen, teenage, medieomtale, interessesammenfaldet, beslutningsgrundlag","mens, jonas, jamen, johannes, træthedssyndrom, menes, johan, træthedsyndrom, rothman, kan","kønssygdommene, kønssygdomme, kønssygdom, kønssygdommen, gynækologer, sexolog, gynækolog, sexsygdomme, sygehistorie, kønsdele","kræfthandlingsplan, kræftdødsfald, kræftplanen, cancerregisteret, cancerregistret, kræftplan, kræftforekomst, kræftproblemerne, kræftbehandling, forbrug","1975, 1985, 1995, 1955, aldersgrænsen, vaccinationstidspunktet, aldersgrænse, fødselsårgang, 1655, 2005","vaccinationsdeltagelsen, vaccinationsdeltagelse, vaccinationstilslutningen, vaccinationsdækningen, danmarksmester, østdanmark, vaccinationsdækning, vaccinedækning, midtjylland, ventelisterne","hundredvis, herlev, hundredevis, bl, kl, træf, sejlivet, løvig, travl, nsls","højteknologifonden, forskningschef, pseudovidenskab, kampagneekspert, informationskampagne, forebyggelseschef, hpvdebattendebatten, offentligheden, centerdirektør, redaktionschef"
