"2014 06 13 - 2015 03 06","mundkræft, mundsvælgkræft, mundsvælgskræft, mundhulekræft, halskræft, hovedhalskræft, kræftvirus, mundsvælget, kræftvirussen, mundtørhed","1977, 1997, 1982, 2012, 1974, 2007, forskningsresultat, 2014, 1992, 2013","gennemsnitsalderen, screeningsalderen, gennemsnitsalder, age, aldersgrænsen, årsalderen, old, aldersgrænse, pensionsalderen, diagnosetidspunktet","kønsvorter, kønsvorterne, fodvorter, kønsvorter2, kondomer, sexsygdomme, kønsvorte, kondomet, seksualvaner, hudvorter","gardasil, gardasils, gardasil9, gradvis, greider, panodil, gerdes, gradvist, hertil, grader","skuespillere, skuespiller, lykkeligste, gunslinger, skuespillerinden, underholdning, bjarne, skuespilleren, forfattere, butikkerne","vaccinebivirkninger, konspirationsteorierne, kræftvaccinen, vaccinationshistoriens, kræftvacciner, kræftvaccinationer, færdigvaccineret, færdigvaccinerede, kræftvaccination, verdenshistorien","livmoderhalskraft, livmoderhals, livmoder, livmoderhalsen, livsmoderhalskræft, livmoderen, livmoderhalskræfter, livmoderhalsens, charlotte, livmoderhalskræftog","screeningsalderen, børneagentur, aldersgrupper, aldersgrupperne, aldersgruppe, aldersgrænse, aldersgrænsen, drengene, ældreminister, aldersgruppen","undersøgelsen, screeningsundersøgelse, screeningsundersøgelser, crüger, kontrolundersøgelser, krüger, screeningsdeltagelsen, undersøgelse, røntgenundersøgelse, undersøgelsens","bivirkningsindberetninger, bivirkningskomitéen, bivirkningskomité, bivirkningsramte, bivirkning, bivirkningsprofil, bivirkningerne, bivirkningsramt, hovedpine, svimmelheds","livmoderhalskræftkoster, livmoderhalskræftpatienter, papillomer, livmoderhalskraeft, underlivskræft, livmoderhalskræftsenere, livmoderhalskræftkan, livmoderhalskræfthvert, livmoderkræft, livmoderhalskræftscreening","screeningsalderen, 26, 35, 69, 260, 135, interessesammenfaldet, 25, ordningen, 65","rothman, videnskabsmand, embedsmand, ugen, ugens, tumoren, emnet, politimand, eus, tømmermænd","hærger, hemmeligheder, hærgede, haarder, hjerter, sundheds, sundhedsproblemer, handlede, hørte, skadede","kræfthandlingsplan, kræftplanen, kræftdødsfald, kræftplan, cancerregistret, kræftbehandling, cancerregisteret, kræftforekomst, kræftbehandlingen, kræftbehandlinger","aldersgrænsen, aldersgrænse, screeningsalderen, gennemsnitsalderen, gennemsnitsalder, fødselsårgang, årsalderen, 1975, pensionsalderen, 1774","danmarksmester, midtjylland, midtjyllands, østdanmark, pigernesresultatet, danskere, vaccinationsdeltagelsen, danskernes, københavnerne, nygaard","kønsvorterne, kønsvorter, kønsvorte, vorter, kønsvorter2, vorte, vorterne, minoriteter, reduktion, vort","smertesymptomer, muskelsmerter, brystsmerter, migræne, strubelågsbetændelse, symptomerne, kløe, knogleskørhed, smertesyndrom, smertesyndromet"
"2015 03 06 - 2015 11 28","omkostningseffektiv, omkostningseffektivt, evalueringen, ligestilles, utilfreds, komiteen, pilotstudie, særafdelinger, ligebehandlingsnævnet, vurderingen","bekymrende, bekymret, bekymringen, usikkerhed, bekymringer, bekymringerne, bekymrede, forsigtig, kræftsyg, forskrækket","age, gennemsnitsalderen, old, screeningsalderen, gennemsnitsalder, years, aged, årsalderen, aldersgrænsen, årig","hovedhalskræft, oncology, kræftsagen, brystkræftsagen, livsmoderhalskræft, kræftforskningen, cancerimmunterapier, hjernekræft, livmoderhalskræften, halskræft","gardasil, gardasils, gardasil9, gradvis, panodil, gradvist, greider, cervarix, gerdes, hertil","skuespillere, skuespiller, skuespillerinden, forfattere, underholdning, lykkeligste, skuespilleren, butikkerne, direktøren, forfatterne","kræftvaccinen, vaccinebivirkninger, kræftvaccine, truffet, kræftvacciner, kræftvaccinationer, svag, kræftvaccination, kræftens, vaccine2","livmoderhalsen, livmoderhals, livmoderhalskraft, livmoder, livmoderhalsens, livsmoderhalskræft, livmoderhalskræfter, livmoderen, livmorhalskræft, livmorhalsen","cost, omkostning, kosten, omkostninger, royalties, udgiften, udgifter, paywall, omkostningerne, bekostning","undersøgelsen, undersøgelsens, befolkningsundersøgelser, forskergrupper, screeningsundersøgelser, hpv16, befolkningsundersøgelse, forskergruppen, vaccinationsforskningen, forskningsundersøgelse","bivirkningsindberetninger, hovedpine, bivirkningsramte, bivirkningskomitéen, bivirkningskomité, bivirkningsramt, smertesymptomer, smertesyndromer, bivirkningerne, symptomerne","livmoderhalskræftkoster, underlivskræft, peniskræft, livmoderhalskraeft, penishovedet, hpvtest, livmoderkræfttilfælde, hpv18, pigernesresultatet, hpv30","medieomtale, interessesammenfaldet, incitamentsaflønning, habilitet, risikoprofil, informationsindsats, screeningsalderen, presseomtale, mediedebat, alkoholforbrug","europas, rothman, træthedsyndrom, emnet, fællesbetegnelsen, ugens, umage, embedsmand, virussens, fællesbetegnelse","gynækologer, gynækolog, læger, læges, gynækologi, søgaard, kønssygdomme, læge, kønssygdom, hærger","papillovirus, hpvvaccinerede, papillomvirus, hpvvirus, virushpv, vaccinenhpv, hoster, hpvinfektion, vaccinehpv, virale","anslår, konkludere, undervurderer, kønsvorter, kønsvorter2, kønsvorte, sønner, værre, versus, konkluderet","østdanmark, danmarksmester, vaccinationsdeltagelsen, vaccinationsdeltagelse, danskernes, danskere, københavnerne, midtjylland, midtjyllands, danskeres","hundredevis, hundredvis, haderslev, herlev, silkeborg, ingerslev, marselisborg, 24syv, rsv, hbv","smertesymptomer, symptomerne, symptomer, muskelsmerter, migræne, mavesår, symptom, børneeksem, brystsmerter, bivirkningsramt"
"2015 11 28 - 2016 08 20","mundkræft, mundsvælgkræft, mundsvælgskræft, mundhulekræft, halskræft, hovedhalskræft, halskræfthos, halscancer, kræftvirus, kræftvirussen","usikkerhed, bekymret, forsigtig, forskrækket, bekymrende, forsigtighed, uansvarligt, bekymrede, kræftvaccination, bekymringen","gennemsnitsalderen, age, screeningsalderen, gennemsnitsalder, old, aged, aldersgrænsen, years, aldersgrænse, årsalderen","hovedhalskræft, kræftforskningen, kræftplanen, oncology, livsmoderhalskræft, hjernekræft, kræftforskning, cancerimmunterapier, livmoderhalskræften, kræftforsker","gardasil, gardasils, gardasil9, gradvis, panodil, gradvist, cervarix, greider, gerdes, gladsaxe","vaccine3, hpvvaccineret, hpvvaccination, højrisikotyper, hpvvaccine, vaccine2, hpv16, hpv, hpvvaccinen, hpvvaccinationen","kræftvaccinen, kræftvacciner, kræftvaccine, vaccinebivirkninger, kræftvaccinationer, kræftvaccination, vacca, kræftens, kræften, svag","livmoderhalsen, livmoderhals, livmoderhalskraft, livmoder, livmoderhalsens, livsmoderhalskræft, livmoderen, livmoderhalskræftog, livmorhalsen, livmorhalskræft","cost, omkostning, omkostninger, royalties, kosten, bekostning, omkostningerne, paywall, udgifter, udgiften","undersøgelsen, forskergrupper, forskningsundersøgelse, vaccinationsforskningen, undersøgelsens, kontrolundersøgelser, spørgeskemaundersøgelse, screeningsundersøgelser, metaanalyse, forskergruppen","bivirkningsindberetninger, bivirkningsramte, hovedpine, bivirkningskomitéen, bivirkningskomité, bivirkningsramt, symptomerne, smertesymptomer, bivirkningerne, bivirkning","livmoderhalskræftkoster, underlivskræft, livmoderhalskraeft, peniskræft, penishovedet, hpvtest, livmoderhalskræfthvert, livmoderkræfttilfælde, livmoderhalskræftpatienter, hpv30","incitamentsaflønning, risikoprofil, interessesammenfaldet, irrelevant, screeningsalderen, samfundssind, integritet, informationsindsats, medieomtale, risikoprofilen","pigernesresultatet, vaccinationsprocenten, halveret, antallet, vaccinationsprocent, deltagerprocenten, næsthyppigste, 1200, halvere, toplinjeresultater","bavarian, nordicbavarian, bavariannordic, bava, ofnasdaq, bvnry, imvanex, nordcan, nasdaq, mva","kræftdødsfald, kræftplanen, kræftplan, kræfthandlingsplan, cancerregistret, cancerregisteret, kræftforekomst, kræftbehandling, kræftpatienters, kræftpatienter","kønsvorte, kønsvorter, konkludere, kønsvorter2, anslår, undervurderer, konstaterer, kønsvorterne, lignende, versus","proof, bevis, beviset, bevist, evidence, hpvtest, attest, bevise, beviser, bevises","hundredevis, hundredvis, haderslev, herlev, rsv, 24syv, ingerslev, hbv, favrskov, løvig","højteknologifonden, forskningschef, journalisthøjskole, pseudovidenskab, centerdirektør, kampagneekspert, kommunikationsrådgiver, forebyggelseschef, videnskabsmand, hpvdebattendebatten"
"2016 08 20 - 2017 05 13","omkostningseffektiv, omkostningseffektivt, evalueringen, utilfreds, vurderingen, pilotstudie, særafdelinger, ligestilles, komiteen, evaluering","usikkerhed, bekymrende, bekymret, uansvarligt, forsigtig, bekymringen, forskrækket, forsigtighed, uansvarlighed, tvivlende","informationsmøde, informationsmødet, informationskampagne, lokalforeningen, pressemøde, lokalforening, pressemødet, oplysningskampagne, hjemmeside, forældremøder","hovedhalskræft, oncology, kræftforskningen, cancerimmunterapier, kræftplanen, halscancer, kræftvaccinationer, kræftsagen, halskræft, kræftlægerne","ungdommen, beboerne, pillerne, forskerne, forskningsarbejde, personerne, nyhedsbureauet, nydiagnosticerede, nyheden, myten","skuespillere, skuespiller, skuespilleren, skuespillerinden, lykkeligste, underholdning, forfattere, direktøren, ældreminister, journalisterne","screeningstest, screeningsundersøgelse, livmoderhalskræftscreening, screeningsundersøgelser, screeningsmetode, screeningsafdeling, screeningsmetoder, screening, screenings, screeningsprøve","drengebørn, drengene, mændene, men, drengenes, drengevaccine, drengevenner, betalt, drenges, drengen","screeningsalderen, børneagentur, aldersgrænse, ældreminister, aldersgrænsen, børnelæger, diagnosetidspunktet, børnelæge, tidsplan, aldersgrupperne","undersøgelsen, befolkningsundersøgelser, screeningsundersøgelser, vaccinationsforskningen, befolkningsundersøgelse, screeningsundersøgelse, undersøgelsens, hpvvaccinerede, hpv16, spørgeskemaundersøgelse","kræftforebyggelse, grad, chancer, kræftforebyggende, respekt, dækningsgrad, dækningsgraden, gengæld, respekten, andel","vaccination, vaccinations, vaccines, vaccinationer, mæslingevacciner, mæslingevaccine, vaccineskeptikere, influenzavaccination, vaccine, vaccinationsskeptiske","medieomtale, interessesammenfaldet, mediedebat, informationsindsats, 35, presseomtale, irrelevant, fagperson, risikoprofil, screeningsalderen","pigernesresultatet, deltagerprocenten, halveret, antallet, vaccinationsprocenten, vaccinationsprocent, halvere, flest, resulterede, næsthyppigste","bavarian, nordicbavarian, bavariannordic, bava, bvnry, imvanex, ofnasdaq, mva, nordcan, nasdaq","kræftdødsfald, kræftplanen, kræftplan, kræfthandlingsplan, cancerregisteret, cancerregistret, kræftbehandling, kræftforekomst, kræftpatienter, kræftpatienters","kønsvorte, kønsvorter, kønsvorter2, tværtimod, omvendt, anslår, livmoderhalskræftkoster, nedslående, kønsvorterne, undervurderer","proof, bevis, evidence, beviset, skepsis, påstå, bevist, hpvtest, overbevisning, beviser","hundredvis, hundredevis, herlev, haderslev, 24syv, rsv, alberslund, albertslund, enkeltvis, hbv","højteknologifonden, pseudovidenskab, forskningschef, forebyggelseschef, kampagneekspert, journalisthøjskole, informationskampagne, hpvdebattendebatten, kommunikationsrådgiver, sundhedssektoren"
"2017 05 13 - 2018 02 03","mundsvælgkræft, mundkræft, mundsvælgskræft, mundhulekræft, halskræft, hovedhalskræft, halskræfthos, halscancer, mundsvælget, tobakssygdom","forskningsresultat, forskningsresultater, 1982, 1774, 1977, 2012, 1955, 1974, 1992, 2013","gennemsnitsalderen, age, screeningsalderen, old, gennemsnitsalder, years, aged, aldersgrænsen, årsalderen, aldersgrænse","hovedhalskræft, cancerimmunterapier, børnekræft, hjernekræft, kræftvaccinationer, livsmoderhalskræft, kræftplanen, kræftlægerne, kræftforskningen, halskræfttilfælde","ungdommen, forskerne, forskergruppe, pillerne, personerne, beboerne, forskningssamarbejde, forskningsarbejde, forskningsbaserede, forskergrupper","vaccine3, hpvvaccineret, papillomvirus, hpvvaccination, vaccinedet, hpv, papillovirus, hpvvaccine, hpvvirus, højrisikotyper","kræftvaccinen, vaccinebivirkninger, kræftvaccine, kræftvacciner, kræften, kræftens, truffet, kræftvaccinationer, kræftvaccination, vacca","drengebørn, drengene, drengenes, drenges, regning, men, egenbetaling, drengen, brugerbetaling, drengevaccine","screeningsalderen, børneagentur, aldersgrænse, aldersgrænsen, diagnosetidspunktet, ældreminister, aldersgrupperne, drengebørn, aldersgrupper, børnelæger","undersøgelsen, vaccinationsforskningen, screeningsundersøgelser, kræftforskere, forskergrupper, screeningsundersøgelse, undersøgelserne, befolkningsundersøgelser, kræftforsker, forskergruppen","dækningsgrad, kræftforebyggelse, chancer, respekt, dækningsgraden, kræftforebyggende, respekten, grad, selektivt, kyndigt","vaccination, vaccinations, mæslingevaccine, mæslingevacciner, vaccines, influenzavaccination, mæslingevaccinen, vaccinationer, vaccine, vaccinering","medieomtale, interessesammenfaldet, informationsindsats, risikoprofil, screeningsalderen, risikoprofilen, 35, 34, incitamentsaflønning, mediedebat","pigernesresultatet, vaccinationsprocenten, halveret, vaccinationsprocent, deltagerprocenten, antallet, indbyggere, næsthyppigste, flest, halvere","bavarian, nordicbavarian, bavariannordic, bava, bvnry, imvanex, ofnasdaq, mva, nasdaq, bmj","papillovirus, papillomvirus, hpvvaccinerede, hpvvirus, hpvvacciner, vaccinehpv, vaccinenhpv, virushpv, hpvvaccinen, papillomavirus","anslår, kønsvorter, kønsvorte, versus, livmoderhalskræftkoster, undervurderer, kønsvorter2, konkludere, tværtimod, omvendt","proof, bevis, beviset, evidence, bevist, hpvtest, skepsis, beviser, bevises, bevise","hundredvis, hundredevis, herlev, haderslev, ingerslev, 24syv, enkeltvis, løvig, frihed, tusindvis","smertesymptomer, symptomerne, muskelsmerter, symptomer, migræne, symptom, børneeksem, bivirkningsramt, brystsmerter, smerter"
"2018 02 03 - 2018 10 27","omkostningseffektiv, omkostningseffektivt, utilfreds, ligestilles, pilotstudie, omkostningsundersøgelse, evalueringen, evaluering, komiteen, lokalafdeling","forskningsresultat, 1993, 1992, 1977, 2007, forskningsresultater, 1994, 1982, 1974, 2003","informationskampagne, informationsmøde, informationsmødet, pressemøde, kommunens, valgkamp, hjemmeside, hjemmesiden, bekæmpelse, pressemødet","hovedhalskræft, hjernekræft, oncology, kræftplanen, kræftforskningen, kræftvaccinationer, livsmoderhalskræft, kræftforskning, cancerimmunterapier, kræftplan","pillerne, ungdommen, personerne, personlighed, ressourcerne, forskningssamarbejde, nydiagnosticerede, myten, forskerne, projekterne","skuespiller, skuespillere, lykkeligste, skuespillerinden, skuespilleren, underholdning, jørgensen, forfattere, ældreminister, bjarne","screeningsmetode, screeningsundersøgelse, screeningstest, screeningsafdeling, screeningsmetoder, screeningsundersøgelser, livmoderhalskræftscreening, screeningsprøve, screeningstilbuddet, mammografiscreening","drengebørn, drengene, drengenes, drengevaccine, drengen, drenges, drenge, dreng, billigste, drengevenner","screeningsalderen, diagnosetidspunktet, aldersgrænse, ældreminister, børneagentur, aldersgrænsen, aldersgrupper, aldersgrupperne, undersøgelsesperioden, årsalderen","befolkningsundersøgelser, befolkningsundersøgelse, vaccinationsforskningen, screeningsundersøgelser, screeningsundersøgelse, screeningsdeltagelsen, undersøgelsen, vaccinationshistoriens, kræftforsker, forskningsundersøgelse","kræftforebyggelse, grad, kræftforebyggende, respekt, dækningsgrad, chancer, alder, påpasselig, screeningsalderen, andel","livmoderhalskræftkoster, underlivskræft, penishovedet, hpvtest, peniskræft, truffet, livmoderhalskraeft, livmoderkræfttilfælde, 1_12sex, pigernesresultatet","medieomtale, incitamentsaflønning, screeningsalderen, fagperson, 35, habilitet, 17, irrelevant, 34, risikoprofil","pigernesresultatet, vaccinationsprocenten, vaccinationsprocent, antallet, halveret, deltagerprocenten, toplinjeresultater, størstedelen, næsthyppigste, vaccinationsraten","bavarian, nordicbavarian, bavariannordic, bava, bvnry, ofnasdaq, imvanex, nordcan, nabolande, mva","papillovirus, papillomvirus, vaccinenhpv, hpvvirus, hpvinfektion, virushpv, vaccinehpv, hpvvaccinerede, hpvvaccinen, hpvvaccinationen","kønsvorte, underrapportering, kønsvorter, undervurderer, anslår, kønsvorter2, versus, mindretal, omvendt, unormalt","proof, bevis, beviset, bevist, evidence, beviser, hpvtest, skepsis, bevises, bevise","kønsvorterne, kønsvorter, kønsvorte, vorter, kønsvorter2, vorterne, vorte, reducerer, kønsorganerne, minoriteter","højteknologifonden, centerdirektør, forebyggelseschef, pseudovidenskab, kampagneekspert, journalisthøjskole, kommunikationsrådgiver, forskningschef, offentligheden, hpvdebattendebatten"
"2018 10 27 - 2019 07 20","komiteen, omkostningseffektiv, pilotstudie, evalueringen, attestudvalget, evaluation, omkostningseffektivt, utilfreds, effectiveness, fortryder","forskningsresultat, forskningsresultater, 1982, 2002, 2003, 2012, 1998, resultat, 1997, 1983","screeningsalderen, gennemsnitsalderen, old, age, gennemsnitsalder, years, aged, aldersgrænsen, årsalderen, livstidsrisikoen","hovedhalskræft, kræftplanen, kræftlægerne, cancerimmunterapier, kræftforskningen, kræftsagen, børnekræft, børnecancerfonden, kræftpakkeforløb, hjernekræft","ungdommen, tankevækkende, jeppe, journalisterne, evne, jeg, evner, amerikanerne, pillerne, puljen","skuespillere, skuespiller, forfattere, lykkeligste, overlægerne, butikkerne, journalisterne, ældreminister, forfatterne, direktøren","screeningstest, screeningsundersøgelse, livmoderhalskræftscreening, screeningsundersøgelser, screeningsmetode, screeningsprøve, screening, screeningsmetoder, screeningsafdeling, screenings","drengebørn, drengene, drenges, drengenes, drengen, drengevaccine, men, hpvtest, egenbetaling, drengevenner","screeningsalderen, børneagentur, drengebørn, aldersgrænse, børnelæger, drengene, aldersgrænsen, aldersgrupper, aldersgruppe, årsalderen","vaccinationsforskningen, undersøgelsen, metaanalyse, kræftforskere, kræftforsker, forskergrupper, forskningsundersøgelse, lægeundersøgelse, vaccinationshistoriens, undersøgelserne","dækningsgrad, dækningsgraden, kræftforebyggelse, grad, respekt, midlet, andel, antistof, kræftforebyggende, grade","vaccination, vaccinations, mæslingevacciner, influenzavaccination, mæslingevaccine, vaccines, vaccinationer, vaccinering, børnevaccinationer, mæslingevaccinen","informationsindsats, medieomtale, informationsindsatsen, screeningsalderen, incitamentsaflønning, risikoprofil, interessesammenfaldet, oplysningsindsats, mediedebat, 17","pigernesresultatet, antallet, vaccinationsprocenten, vaccinationsprocent, deltagerprocenten, næsthyppigste, halveret, 1997, vaccinationsraten, indbyggere","bavarian, nordicbavarian, bavariannordic, bava, bvnry, ofnasdaq, imvanex, mva, nordcan, bmj","kræftplanen, kræftdødsfald, kræfthandlingsplan, cancerregisteret, kræftplan, cancerregistret, kræftforekomst, kræftbehandling, kræftbehandlingen, kræftramte","aldersgrænsen, aldersgrænse, vaccinationstidspunktet, fødselsårgang, pensionsalderen, sygdomsfri, free, gratis, årsalderen, 1995","proof, evidence, bevis, beviser, beviset, bevist, beskrev, prevent, skepsis, hpvtest","kønsvorterne, kønsvorter, kønsvorte, kønsvorter2, vorter, kønsorganerne, vorterne, minoriteter, kønsorganer, vort","smertesymptomer, symptomerne, symptomer, børneeksem, symptom, muskelsmerter, migræne, bivirkningsramt, synkebesvær, følgevirkninger"
"2019 07 20 - 2020 04 11","omkostningseffektiv, vurderingen, evalueringen, ligebehandlingsnævnet, pilotstudie, apotekerforening, omkostningseffektivt, komiteen, registerstudie, utilfreds","forskningsresultat, forskningsresultater, 1992, 1993, 1995, 1982, 2012, 2002, 1994, nobelpris","informationsmøde, informationsmødet, informationskampagne, pressemøde, pressemødet, præsentation, lokalforeningen, lokalforening, oplysningskampagne, hjemmeside","kønsvorter, kondomer, fodvorter, kønsvorterne, kondomet, kondom, seksualvaner, seksualpartnere, kønsvorter2, sexpartnere","gardasil, gardasils, gardasil9, gradvis, panodil, cervarix, gladsaxe, gerdes, greider, gradvist","skuespillere, skuespiller, skuespilleren, skuespillerinden, direktøren, lykkeligste, underholdning, butikkerne, forfattere, aktørerne","kræftvaccinen, kræftvacciner, kræftvaccine, smøgerne, truffet, vaccinebivirkninger, kræftvaccinationer, tophistorie, konspirationsteorierne, kræftvaccination","drengebørn, drengevaccine, drengene, drengen, dreng, drengenes, drenges, drenge, regning, egenbetaling","screeningsalderen, aldersgrænse, aldersgrænsen, drengebørn, diagnosetidspunktet, tidsplan, ældreminister, aldersgrupperne, aldersgrupper, aldersgruppe","screeningsdeltagelsen, vaccinationsforskningen, vaccineskepsis, screeningen, vaccinationsdeltagelsen, vaccinationshistoriens, screeningsundersøgelse, screeningsdeltagelse, screeningsundersøgelser, vaccinationsdeltagelse","kræftforebyggelse, originality, kræftforebyggende, respekt, dækningsgrad, gengæld, forbyde, tidobling, golf, andel","vaccination, vaccinations, vaccines, mæslingevacciner, mæslingevaccine, mæslingevaccinen, influenzavaccination, vaccine, børnevaccinationer, vaccinationer","kræftvaccinen, kræftforsker, kræftforskere, kræftvacciner, vaccinationsforskningen, kræftvaccine, mæslingevacciner, kræftforskningen, forskerkolleger, kræftforskeres","vaccinationsprocenten, vaccinationsprocent, vaccinationsraten, pigernesresultatet, halveret, antallet, deltagerprocenten, procent, næsthyppigste, højest","kønssygdomme, kønssygdommene, kønssygdommen, kønssygdom, læger, gynækologer, sundhedseksperter, læges, sexsygdomme, gynækolog","papillovirus, papillomvirus, hpvvaccinerede, virushpv, hpvvirus, vaccinehpv, vaccinenhpv, hpvvaccinen, hpvvaccine, livmoderhalsen","undervurderer, omdiskuteret, konkludere, anslår, tværtimod, omdiskuterede, omvendt, konkluderet, livmoderhalskræftkoster, overrepræsentation","vaccinationsdeltagelsen, vaccinationsdeltagelse, michan, danmarksmester, mandlerne, københavnerne, østdanmark, københavnsområdet, danskere, pigernesresultatet","kønsvorterne, kønsvorter, kønsvorte, vorter, vorte, kønsvorter2, vorterne, minoriteter, vort, reducerer","forebyggelseschef, forskningschef, højteknologifonden, centerdirektør, pseudovidenskab, pressechef, kommunikationsrådgiver, kampagneekspert, redaktionschef, offentligheden"
"2020 04 11 - 2021 01 02","mundsvælgkræft, mundsvælgskræft, mundkræft, mundhulekræft, halskræfthos, hovedhalskræft, halskræft, mundsvælget, mundsvælg, halscancer","2004, 1994, 1992, 1974, 1984, 1982, 2012, 1991, 1998, forskningsresultat","informationsmøde, informationsmødet, informationskampagne, hjemmesiden, hjemmeside, pressemøde, lokalforening, kommunens, nærværende, lokalforeningen","fodvorter, kønsvorter, kønsvorterne, kondomer, hudvorter, kønsvorte, vorter, kønsvorter2, smittespredningen, ubeskyttet","personlighed, forskningsarbejde, nydiagnosticerede, personerne, ungdommen, detektivarbejde, journalisterne, partierne, nyhederne, tankevækkende","hpvvaccineret, hpvvaccination, hpv, vaccine2, hpvvaccine, højrisikotyper, hpvvaccinationen, vaccine3, hpvvaccinen, livmoderhalskræftvaccinen","kræftvaccinen, vaccinebivirkninger, kræftvaccine, kræftvacciner, kræftvaccination, kræftvaccinationer, truffet, vaccinedebatten, kræften, vaccine3","drengebørn, paywall, drengene, egenbetaling, brugerbetaling, drenges, drengenes, free, drengevenner, men","screeningsalderen, aldersgrænse, aldersgrænsen, børneagentur, aldersgrupperne, aldersgrupper, tidsplan, prioriteret, drengebørn, diagnosetidspunktet","overskygger, forskergrupper, forskergruppen, crüger, opfanger, forskergruppe, krüger, påbegynder, mavepine, screeningsundersøgelser","kræftforebyggelse, kræftforebyggende, dækningsgrad, grad, respekt, chancer, dækningsgraden, reagensglasbefrugtning, andel, respekten","vaccinations, vaccination, vaccines, mæslingevacciner, mæslingevaccine, vaccinationer, vaccine, vaccinationsskeptiske, børnevaccinationer, vaccinationsordningen","kræftvaccinen, vaccinationsforskningen, kræftvacciner, kræftvaccine, kræftvirussen, kræftforsker, kræftvirus, kræftforskningen, kræftforskere, kræftcelle","antallet, halveret, pigernesresultatet, vaccinationsprocenten, vaccinationsprocent, indbyggere, årevis, resultatet, hyppigste, deltagerprocenten","bavariannordic, bavarian, nordicbavarian, ofnasdaq, bvnry, adaptvac, nasdaq, imvanex, nordcan, bava","kræftdødsfald, kræftplanen, kræftplan, kræfthandlingsplan, cancerregisteret, kræftbehandling, cancerregistret, kræftforekomst, kræftbehandlingen, kræftbehandlinger","kønsvorter, kønsvorter2, kønsvorte, undervurderer, versus, kønsvorterne, konkludere, værre, forværre, tværtimod","østdanmark, vaccinationsdeltagelsen, vaccinationsdeltagelse, danskere, odenseaner, danmarksmester, danskernes, pigernesresultatet, københavnerne, danskeres","hundredvis, hundredevis, herlev, haderslev, hbv, freil, 24syv, rsv, bodil, liste","smertesymptomer, muskelsmerter, migræne, symptom, symptomerne, symptomer, celle, sygdomssymptomer, allé, smerter"
